{
  "vector_format": 1,
  "contract": "theatre-mock-playback@1",
  "id": "buffering",
  "initial_state": {
    "generation": 4,
    "session": {
      "source": {
        "work_id": "son-ha-ky",
        "episode_index": 2,
        "duration_ms": 1722000
      },
      "position_ms": 768000,
      "speed_permille": 1000,
      "intent": {
        "type": "play"
      },
      "engine": "running",
      "interruption": "none"
    },
    "status": "simulating",
    "pause_cause": null
  },
  "steps": [
    {
      "event": {
        "type": "engine_buffering",
        "identity": {
          "work_id": "son-ha-ky",
          "episode_index": 2,
          "generation": 4
        }
      },
      "expected": {
        "state": {
          "generation": 4,
          "session": {
            "source": {
              "work_id": "son-ha-ky",
              "episode_index": 2,
              "duration_ms": 1722000
            },
            "position_ms": 768000,
            "speed_permille": 1000,
            "intent": {
              "type": "play"
            },
            "engine": "buffering",
            "interruption": "none"
          },
          "status": "buffering",
          "pause_cause": null
        },
        "effects": []
      }
    },
    {
      "event": {
        "type": "engine_started",
        "identity": {
          "work_id": "son-ha-ky",
          "episode_index": 2,
          "generation": 4
        }
      },
      "expected": {
        "state": {
          "generation": 4,
          "session": {
            "source": {
              "work_id": "son-ha-ky",
              "episode_index": 2,
              "duration_ms": 1722000
            },
            "position_ms": 768000,
            "speed_permille": 1000,
            "intent": {
              "type": "play"
            },
            "engine": "running",
            "interruption": "none"
          },
          "status": "simulating",
          "pause_cause": null
        },
        "effects": []
      }
    },
    {
      "event": {
        "type": "pause_requested"
      },
      "expected": {
        "state": {
          "generation": 5,
          "session": {
            "source": {
              "work_id": "son-ha-ky",
              "episode_index": 2,
              "duration_ms": 1722000
            },
            "position_ms": 768000,
            "speed_permille": 1000,
            "intent": {
              "type": "pause",
              "cause": "user"
            },
            "engine": "paused",
            "interruption": "none"
          },
          "status": "paused",
          "pause_cause": "user"
        },
        "effects": [
          {
            "type": "pause_engine",
            "identity": {
              "work_id": "son-ha-ky",
              "episode_index": 2,
              "generation": 5
            },
            "source": {
              "work_id": "son-ha-ky",
              "episode_index": 2,
              "duration_ms": 1722000
            },
            "position_ms": 768000,
            "speed_permille": 1000
          }
        ]
      }
    },
    {
      "event": {
        "type": "engine_buffering",
        "identity": {
          "work_id": "son-ha-ky",
          "episode_index": 2,
          "generation": 4
        }
      },
      "expected": {
        "state": {
          "generation": 5,
          "session": {
            "source": {
              "work_id": "son-ha-ky",
              "episode_index": 2,
              "duration_ms": 1722000
            },
            "position_ms": 768000,
            "speed_permille": 1000,
            "intent": {
              "type": "pause",
              "cause": "user"
            },
            "engine": "paused",
            "interruption": "none"
          },
          "status": "paused",
          "pause_cause": "user"
        },
        "effects": []
      }
    }
  ]
}
